Minimum parking requirements,"parking spots, parking spaces, parking, off-street spaces require,
 minimum parking require, minimum spaces require, vehicle, one space for","For particular parking requirements match on the following terms:
  
 parking space, parking spaces, parking spot, parking spots, parking, guest space, per du, per dwelling unit, per unit, minimum parking require, for each dwelling unit, for every dwelling unit, for each apartment, minimum spaces require, for each family, spaces","Matches above 10 parking spaces per unit are not allowed.
  
 If no parking information is found via the regular process, we conduct additional regular expression searches."
Permit multi-family by right,"residential districts, residential district, residential single-family district, residential multi family district, residential single family district, single residential, multiple residential, density residential, zoning district schedules, three-family district, residential detached zones,
 residential multi family district residential multiple-family district, residential zone, residential multi family district, zoning districts, zoning district, zone district, multi family residential, single family residential, land use districts, residential high density, residential medium density, rural residential, residential one acre, residential two acre, housing district, residence zone, residential zone, dwelling zone, multiuse zone, mid-rise district, high-rise district, mixed use zone, overlay district, use regulation schedule, housing (four stories or less) district, residential overlay, one-family zone, multi family zone, classes of districts, district, district that is designed to, residence districts, residential classifications, district regulations, creation of districts, dwelling district:, r1 district, r2 district, r3 district, r4 district, r5 district, r6 district, r7 district, r-1 district, r-2 district, r-3 district, r-4 district, residential-general district, low density district, medium density district, high density district, rural density district, general residence district, residential use district, residence district, residential urban district, residential suburban district, residential limited business district, re residential-existing district, conservation district, r-16 district, low density residential, medium density residential, rm district, low density-residential, medium-density residential, medium-high-density residential,
 r-1 residential., r-2 residential., r-3 residential., residence a district, residence aa district, residence b district, residence bb district, residence c-1 district, residence c-2 district, residence cc district,
 residence d district, residence dd district, residence e district, residence ee district, residence f district, residence ff district, residence k district, residence a-1, residence a-2, low-rise, medium-rise, high-rise,district, residential urban zone, residential flexible zone, urban residence, suburban residence","single family residence district, duplex residence district, sfrt, multiple residence district, res-x, r-x-x. xr-x, xr-x, ag, ae, rhd, re-x, rx-x, gr-x, sr-x, rax, rbx, ah-x, ga-x, th, rco, orc, rcd, rcm, ra, rex, rtx, rp-x, r-xmh, m-u-x, r-m-x, r-md-sz, md-x, r-hd-sz, rd-x, rp, gr, su, 1f-x, re, rd, rgx, rms, rmm, rcp, rc, ro, rnc, tld, tmd, thd, cd, rmf-x, rmf, rmh, r-x-e, rm-x, rs, r, srr, rr, rh, ru-x, rsh-x, src, srl, srh, rlx, rhx, r:x, sr, fr, rx-, sfr-x, sfr, mhr, vldr, tn-ldr, tn-mdr, mcn-ldr, mcn-mdr, mon-ldr, mon-mdr, ldr, sfa, url, ar-x, sf-x, 2f-x, mf-x, r/c, ot-mf, ot-sf, nrx, lrx, smu-slu, sm-x, ncx, mf-x, rm, rx, r-xx, os-x, otr, smf, emf, mmf, hr, mfx, mf, tf, mp, sn, rcr, ora, ira, slo, llrd, ldd, ld-r, md-r, mhd-r, hd-r, rs, lrr, lr-x, lr, ur-ld, ur-md, ur-hd, ur, ovr, vr-mf, vr, hrc, hr, mmh, scmxd, mxd, ru, rf, mxr, r-.x, h-x-x, nc, tnx, t-xx, tx, mhp, rmo, rso, rsf, rlm-x, rlm, r-ld, r-mf, r-mf, sfx, rmx, murzd, mu-r-x, mh-x, mh, mdr, hdr, dmu, mu, mn, tcmu, pdm, tr, lhc, lha, rb, oh, rth, arzd, rzd, vzd, dm-x, ul-x, um-x, uh-x, mc, mr, ns, nu, mx-x, dd-x, x-x, single family dwelling district, two family dwelling district, multi family dwelling district, a apartment, osx, a-a, exx, ex, ga, residential x, office/residential, crd, crd-x, residence a-x, residence c-x, residence e, residence f, residenca aaa, residence aa, residence a, o residential use district, residence x, class ux, residential x, ceod, un-x, ddh, mdrd, x single family district, low-rise apartment district, high-rise apartment district, nrd, rdd, ub, aho-x, rt, tr-x, cr-x, ce-x, cdd, mfrd, mfr-x, cr, neighborhood, urban, village residential, residential-commercial, general residence district, residence x, x-acre single family district, x square foot single family, low-rise multi family, medium rise multi family, family district, a residence districts, b residence districts, r residential district, district x, x residence districts, x residential districts, district x, harbor village district, traditional village district, multiple dwelling district, village district, rural residential district, general residential district, rural district, medium density district, affordable housing overlay zone, affordable housing overlay district, multiple dwelling district, dwelling district, garden apartment district, residential-general, rural residential, x district, low-density residential, medium-density residential, high-density residential, residential district x, residential district, residence district, two family residence district, x dwelling district, multi family residence district","The code includes a series of procedures to shorten or cut-off strings when necessary to avoid false-positive matches. 
  
 If no residential districts are found or no residential districts have any matching values, we conduct a series of additional regular expression searches."
